{
  "skill_name": "skill-authentication",
  "phase": "fase1",
  "timestamp": "2026-07-28T14:00:00Z",
  "status": "passed",
  "summary": "Sistema de autenticacion implementado con Argon2id, cookies seguras (HttpOnly, Secure, SameSite=Strict), rate limiting (5 intentos/15min), RBAC (admin/standard), cambio obligatorio de contrasena en primer login. Usuarios Ruben y Esme creados con hashes Argon2id.",
  "metrics": {
    "users_created": 2,
    "hash_algorithm": "argon2id",
    "checks_passed": 10,
    "checks_failed": 0
  },
  "checks": [
    {"id": "C01", "description": "Argon2id configurado", "status": "passed", "detail": "time_cost=3, memory=65536, parallelism=4"},
    {"id": "C02", "description": "hash_password()", "status": "passed", "detail": "formato $argon2id$v=19$"},
    {"id": "C03", "description": "verify_password()", "status": "passed", "detail": "verifica correctamente"},
    {"id": "C04", "description": "Sesiones itsdangerous", "status": "passed", "detail": "URLSafeTimedSerializer con max_age 8h"},
    {"id": "C05", "description": "POST /login exitoso", "status": "passed", "detail": "set-cookie HttpOnly Secure SameSite=Strict"},
    {"id": "C06", "description": "POST /login fallido + rate limiting", "status": "passed", "detail": "5 intentos = 15min bloqueo (status 423)"},
    {"id": "C07", "description": "RBAC: require_admin", "status": "passed", "detail": "solo role='admin' accede"},
    {"id": "C08", "description": "POST /change-password", "status": "passed", "detail": "cambio forzado en primer login"},
    {"id": "C09", "description": "POST /logout", "status": "passed", "detail": "delete-cookie"},
    {"id": "C10", "description": "Usuarios creados", "status": "passed", "detail": "Ruben (admin) + Esme (standard) en PostgreSQL"}
  ],
  "artifacts_generated": [
    {"path": "app/auth/password.py", "type": "source"},
    {"path": "app/auth/session.py", "type": "source"},
    {"path": "app/auth/routes.py", "type": "source"},
    {"path": "app/auth/permissions.py", "type": "source"},
    {"path": "app/main.py", "type": "source"},
    {"path": "scripts/init_users.py", "type": "script"}
  ]
}
