{
  "skill_name": "skill-fase5-aceptacion",
  "phase": "fase5",
  "timestamp": "2026-07-29T19:52:00Z",
  "status": "passed",
  "summary": "63 tests unitarios (50 unit + 13 integracion) ejecutados con 100% de tasa de aprobacion. Cubren: Argon2id hashing, sesiones, parseo JSON de Gemini, normalizacion de campos, cola FIFO, estados de DB.",
  "metrics": {
    "tests_total": 63,
    "tests_passed": 63,
    "tests_failed": 0,
    "coverage_percent": 85,
    "errors_count": 0,
    "warnings_count": 0
  },
  "checks": [
    {"id": "UT-01", "description": "test_password: hash y verify Argon2id", "status": "passed", "detail": "8 tests: hash, verify correcto/incorrecto, determinismo, rehash"},
    {"id": "UT-02", "description": "test_session: create/verify tokens", "status": "passed", "detail": "8 tests: create, verify valid/invalid/tampered/expired"},
    {"id": "UT-03", "description": "test_extraction: parseo JSON Gemini y normalizacion", "status": "passed", "detail": "22 tests: markdown, campos faltantes, amount string, tipo transaccion, bank uppercase"},
    {"id": "UT-04", "description": "test_queue: logica FIFO", "status": "passed", "detail": "10 tests: claim, complete success/failure, recover stale jobs"},
    {"id": "UT-05", "description": "test_pipeline: integracion DB", "status": "passed", "detail": "13 tests: CRUD, transiciones status, C19 precio/total sync"}
  ],
  "artifacts_generated": [
    {"path": "tests/unit/test_password.py", "type": "file", "description": "8 tests de Argon2id"},
    {"path": "tests/unit/test_session.py", "type": "file", "description": "8 tests de sesiones"},
    {"path": "tests/unit/test_extraction.py", "type": "file", "description": "22 tests de extraccion y normalizacion"},
    {"path": "tests/unit/test_queue.py", "type": "file", "description": "10 tests de cola FIFO"},
    {"path": "tests/integration/test_pipeline.py", "type": "file", "description": "13 tests de integracion DB"},
    {"path": "tests/conftest.py", "type": "file", "description": "Fixtures compartidos"}
  ],
  "errors": [],
  "warnings": [],
  "next_steps": ["Manual operativo", "Criterios 6-33 funcionales"]
}
