{
  "skill_name": "skill-installer",
  "phase": "fase4",
  "timestamp": "2026-07-29T15:12:00Z",
  "status": "passed",
  "duration_seconds": 120,
  "summary": "Base de datos gastos_ia y usuario gastos_app existentes de Fase 1. Password de gastos_app actualizada. Conexion verificada desde la VM. Las 10 tablas estan inicializadas (users, expense_records, image_files, extraction_runs, processing_queue, catalog_cache, sheet_sync, audit_events, system_settings, alembic_version).",
  "metrics": {
    "tables_count": 10,
    "users_count": 2,
    "connection_status": "accepting",
    "errors_count": 0
  },
  "checks": [
    {"id": "DB-01", "description": "Base de datos gastos_ia existe", "status": "passed", "detail": "Creada en Fase 1, encoding UTF8, locale es-MX"},
    {"id": "DB-02", "description": "Usuario gastos_app existe y tiene acceso", "status": "passed", "detail": "Password actualizada, permisos GRANT ALL en schema public"},
    {"id": "DB-03", "description": "Conexion gastos_app verificada", "status": "passed", "detail": "SELECT 1 exitoso desde VM via psql"},
    {"id": "DB-04", "description": "Tablas inicializadas (10)", "status": "passed", "detail": "users, expense_records, image_files, extraction_runs, processing_queue, catalog_cache, sheet_sync, audit_events, system_settings, alembic_version"},
    {"id": "DB-05", "description": "Usuarios Ruben y Esme existen", "status": "passed", "detail": "Ruben (admin, is_active=true), Esme (standard, is_active=true)"}
  ],
  "artifacts_generated": [],
  "errors": [],
  "warnings": [],
  "next_steps": ["Configurar Google Sheets", "Llenar variables de entorno"]
}
