{
  "skill_name": "skill-installer",
  "phase": "fase4",
  "timestamp": "2026-07-29T15:19:05Z",
  "status": "passed",
  "duration_seconds": 180,
  "summary": "Diagnostico del sistema generado sin secretos. VM Ubuntu 24.04 con 4 vCPU, 15 GB RAM, 58 GB disco (43 GB libre). Servicios gastos-ia, caddy y ollama activos. PostgreSQL aceptando conexiones. SMB Ruben y Esme montados. 2 usuarios configurados. App sirviendo en https://gastos.local.",
  "metrics": {
    "cpu_count": 4,
    "ram_total_gb": 15,
    "disk_free_gb": 43,
    "services_active": 3,
    "tables_count": 10,
    "users_configured": 2,
    "smb_mounts": 2,
    "no_secrets": true,
    "errors_count": 0
  },
  "checks": [
    {"id": "DIAG-01", "description": "Especificaciones VM", "status": "passed", "detail": "4 vCPU, 15Gi RAM, 58G disco (43G libre, 23%)"},
    {"id": "DIAG-02", "description": "Servicios activos", "status": "passed", "detail": "gastos-ia, caddy, ollama: active"},
    {"id": "DIAG-03", "description": "Base de datos conectada", "status": "passed", "detail": "PostgreSQL 192.168.100.45:5432, pg_isready: accepting"},
    {"id": "DIAG-04", "description": "Modelo Ollama", "status": "passed", "detail": "qwen3-vl:4b"},
    {"id": "DIAG-05", "description": "SMB montado", "status": "passed", "detail": "Ruben=true, Esme=true"},
    {"id": "DIAG-06", "description": "Permisos env file", "status": "passed", "detail": "600 root:root"},
    {"id": "DIAG-07", "description": "Sin secretos en diagnostico", "status": "passed", "detail": "Verificado: no passwords, tokens, API keys, session secrets"}
  ],
  "artifacts_generated": [
    {"path": "scripts/diagnostics/diagnostic-2026-07-29.json", "type": "file", "description": "Diagnostico JSON sin secretos"}
  ],
  "errors": [],
  "warnings": ["Directorio tests/ no existe. Tests unitarios pendientes para Fase 5."],
  "next_steps": ["Fase 5: Pruebas de aceptacion", "Crear tests unitarios", "Corregir errores de ruff"]
}
