{
  "skill_name": "skill-installer",
  "phase": "fase4",
  "timestamp": "2026-07-29T15:15:00Z",
  "status": "passed",
  "duration_seconds": 120,
  "summary": "Archivo de entorno /etc/gastos-ia/gastos-ia.env completamente poblado con 11 variables. Sin valores vacios (0 confirms). Permisos 600 root:root. Session secret generado con openssl rand -hex 32.",
  "metrics": {
    "variables_total": 11,
    "empty_values": 0,
    "permissions": "600",
    "owner": "root:root"
  },
  "checks": [
    {"id": "ENV-01", "description": "GASTOSIA_APP_ENV=production", "status": "passed"},
    {"id": "ENV-02", "description": "GASTOSIA_DATABASE_HOST configurado", "status": "passed", "detail": "192.168.100.45"},
    {"id": "ENV-03", "description": "GASTOSIA_DATABASE_PASSWORD configurado", "status": "passed"},
    {"id": "ENV-04", "description": "GASTOSIA_SESSION_SECRET generado (64 chars hex)", "status": "passed"},
    {"id": "ENV-05", "description": "GASTOSIA_SMB_USERNAME y SMB_PASSWORD configurados", "status": "passed"},
    {"id": "ENV-06", "description": "GASTOSIA_GOOGLE_CREDENTIALS_PATH y SPREADSHEET_ID configurados", "status": "passed"},
    {"id": "ENV-07", "description": "Permisos 600 root:root", "status": "passed", "detail": "Verificado con stat"},
    {"id": "ENV-08", "description": "Sin valores vacios", "status": "passed", "detail": "grep -c '=$' = 0"}
  ],
  "artifacts_generated": [
    {"path": "/etc/gastos-ia/gastos-ia.env", "type": "file", "description": "Archivo de entorno con 11 variables, 600 root:root"}
  ],
  "errors": [],
  "warnings": [],
  "next_steps": ["Activar servicios systemd"]
}
