{
  "skill_name": "skill-fase0-tecnica",
  "phase": "fase0",
  "timestamp": "2026-07-28T12:40:00Z",
  "status": "passed",
  "duration_seconds": 4.2,
  "summary": "PostgreSQL 15.12 en Windows Server (192.168.100.45:5432) validado. Base de datos gastos_ia creada, usuario gastos_app creado con permisos CONNECT/USAGE/CREATE en schema public. CRUD verificado con tabla de prueba. 7/7 checks pasados.",
  "metrics": {
    "tests_total": 7,
    "tests_passed": 7,
    "tests_failed": 0,
    "postgresql_version": "PostgreSQL 15.12 on x86_64-pc-mingw32 (Visual C++ build 1942)",
    "host": "192.168.100.45",
    "port": 5432,
    "database": "gastos_ia",
    "app_user": "gastos_app"
  },
  "checks": [
    {"id": "C01", "description": "Conectividad al servidor", "status": "passed", "detail": "PostgreSQL 15.12, Visual C++ build 1942, 64-bit"},
    {"id": "C02", "description": "Creacion de base de datos gastos_ia", "status": "passed", "detail": "creada exitosamente"},
    {"id": "C03", "description": "Creacion de usuario gastos_app", "status": "passed", "detail": "creado exitosamente"},
    {"id": "C04", "description": "Otorgamiento de permisos", "status": "passed", "detail": "CONNECT, USAGE, CREATE otorgados"},
    {"id": "C05", "description": "CRUD en tabla de prueba", "status": "passed", "detail": "CREATE, INSERT, SELECT exitosos"},
    {"id": "C06", "description": "Limpieza de tabla de prueba", "status": "passed", "detail": "DROP TABLE exitoso"},
    {"id": "C07", "description": "Conexiones activas monitoreables", "status": "passed", "detail": "pg_stat_activity accesible"}
  ],
  "artifacts_generated": [
    {"path": "scripts/validation/validate_postgresql.py", "type": "script", "description": "Script de validacion PostgreSQL (bug fix aplicado)"}
  ],
  "errors": [],
  "warnings": [],
  "next_steps": [
    "Ejecutar validate_sheets.py cuando la credencial de Google este disponible",
    "Ejecutar benchmark_modelos.py cuando Ollama este instalado"
  ]
}
